id,query,label
1524,چرا اساتید امتحانات را در ساعت خارج از زمان کلاس ها برگزار می کنند؟,4
1525,چه زمانی جهت دریافت معرفی نامه کارآموزی باید مراجعه کرد؟,1
1526,طریقه پرداخت آنلاین دیرکرد چگونه است؟,3
1527,سالن های ورزش کجاست؟,2
1528,چجوری میتونم کتابی که میخوام را پیدا کنم؟,3
1529,میزان جریمه کتابخونه من چقدره؟,3
1530,گواهی اشتغال به تحصیل.,1
1531,بیست و ششم این ماه چه روزیه؟,5
1532,ویراست چندم کتاب هوش مصنوعی راسل موجود هست؟,3
1533,دیپلم رو به چه کسی تحویل بدیم؟,1
1534,آسانسور روبروی در دانشکده خراب است.,4
1535,چه مسابقاتی در دانشکده برگزار میشود؟,3
1536,کتابخانه کدام طبقه است؟,2
1537,چطوری می تونم تغییر رشته بدم؟,1
1538,صندلی های کلاس 408 شکسته اند اکثرشون.,4
1539,OS کامپیوتر های سایت چیه؟,3
1540,ردیت یا تیک تاک؟,5
1541,بسیار از درس های دانشگاه کاربردی ارائه نمیشوند.,4
1542,کلاس ها کی حضوری می شود؟,4
1543,کتاب های خاص را می توان امانت بگیرم؟,3
1544,کلاس درس الگوریتم کجاست؟,1
1545,ای کاش هرچه زودتر اقداات لازم برای حضوری شدن دانشگاه انجام شود,4
1546,اگر یک درس را بیفتیم، درس همنیازش هم افتاده حساب میشه؟,1
1547,برگه ورود به جلسه امتحان را از کجا باید گرفت؟,1
1548,تمرین الگوریتم رو نوشتی؟,5
1549,اگر در درس مدرسه تکمیلی پاس نشویم چ میشود؟,1
1550,دربی ساعت چند شروع میشه؟,5
1551,سقف واحدهای هر ترم چقدر هست؟,1
1552,در مهلت حذف و اضافه، چند درس می توان حذف کرد؟,1
1553,امکانات ورزشی دانشگاه چیه؟,2
1554,دانشجویان کجا رفتند؟,5
1555,مواد اولیه دستگاه قهوه ساز تمام شده است. پرش کنید.,4
1556,کتاب دایتل رو دارید؟,3
1557,سرویس بهداشتی کجاست؟,2
1558,صابقه داشته که نظر سنجی اساتید تمدید بشه ؟,1
1559,با چه نمره ای مشروط می شویم؟,1
1560,برای برداشتن مجدد یک درس مجبور به پرداخت هزینه نشویم,4
1561,چطور می توانم درخواست خرید یک کتاب جدید را به کتابخانه بدهم؟,3
1562,سامانه گلستان لینکش چیه ؟,1
1563,چگونه می توان شناسه اینترنت دانشجویی را تغییر داد؟,1
1564,در مجموع چند واحد اختیاری باید پاس کنیم؟,1
1565,فاصله ترما واقعا کمه,4
1566,اساتید نمرات را بیشتر از ۱۰ روز طول میکشد وارد سیستم کنند.,4
1567,برای خواندن ارشد بدون کنکور در دانشکده چه شرایطی لازم است؟,2
1568,دانشکده چند نفر ورودی ارشد دارد؟,5
1569,لاکر های دانشکده کجا هستند؟,2
1570,خوابگاه بسته اس؟,2
1571,آیا تو زمان امتحانات می شود از دانشجویان پروژه خواست؟؟,1
1572,چرا سایت دانشگاه اینقدر کنده؟,4
1573,امروز مناسبت خاصی هست؟,5
1574,دانشکده کامپیوتر شب ها تا چه زمانی باز است؟,2
1575,نزدیکترین دستشویی کجاست؟,2
1576,چجوری میتونم مرخصی تحصیلی بگیرم؟,1
1577,کارت ورود به جلسه برای امتحانات نیاز داریم؟,1
1578,اعضای انجمن علمی دانشکده چه کسانی هستند؟,5
1579,علائم کرونا چیست؟,5
1580,آیا کتابخانه باز است؟,2
1581,زمین فوتبال کدام سمت است؟,2
1582,تا ساعت چند کتابخانه بازاست؟,3
1583,حذف اضطراری من تائید نشده.,1
1584,محل مطالعه کجاست؟,3
1585,اتاق بازی کجاست؟,2
1586,از دکتر حسابی کتاب دارین؟,3
1587,آخرین مهلت انتخاب واحد چه زمانی است؟,1
1588,چرا زمان آزمون ها در مجازی انقدر کم است؟,4
1589,دستگاه قهوه دانشکده خراب است.,4
1590,زمان برگذاری کلاس ها از چه تاریخی است؟,1
1591,آیا آواز خواندن در دانشگاه مجازه؟,5
1592,دانشگاه شهید بهشتی رتبه جهانیش چنده,5
1593,قیمت مسکن در تهران؟,5
1594,کارتخوان دستگاه قهوه ساز خراب شده,4
1595,وام دانشجویی چجوریاست؟,1
1596,ساعت استفاده از سایت دانشگاه چگونه است؟,2
1597,چرا تی ای های دانشکده برق ول کن نیستن؟,5
1598,انقلاب اسلامی کی اتفاق افتاد؟,5
1599,چند واحد در حذف اضطراری می شود حذف کرد؟,1
1600,امروز بیرون میری؟,5
1601,در فضای مطالعه حرف میزنند.,3
1602,رمز کامپیوتر ها چیه؟,3
1603,جریمه تحویل ندادن کتاب چقدر است ؟,3
1604,درس طراحی الگوریتم یه استاد دیگه ارائه بده.,4
1605,در استخر به دانشکده نزدیک تره.,5
1606,آخرین چاپ کتاب هوش موجود هست؟,3
1607,استخر کی باز هست؟,5
1608,چرا سامانه گلستان اینقدر کنده؟,4
1609,ما باید جور نیومدن اساتید بکشیم,4
1610,آیا کتاب جاوای دایتل در کتابخانه موجود است؟,3
1611,جلوگیری از گیرهای حراست به ظاهر دانشجویان,4
1612,آخرین مهلت حذف و اضافه کی است؟,1
1613,کتاب میخواستم اهدا کنم به کتابخونه.,3
1614,چند سال هست که دانشکده تو این مکان فعلی قرار دارد؟,5
1615,ساعت تردد سرویس خوابگاه؟,2
1616,کلاس 111 کجا هست؟,2
1617,شرایط حذف اضطراری چیست؟,1
1618,هزینه ترم تابستان چقدر می باشد؟,1
1619,حداقل ظرفیت مرود نیاز برای تشکیل شدن کلاس چقدر است؟,1
1620,سنوات تحصیلی یعنی چی؟,1
1621,از سخنران های مطرح دعوت کنید سخنرانی کنن.,4
1622,حذف و اضافه اول ترم چطوریه؟,1
1623,تا چه ساعتی مجاز به ورود به خوابگاهیم؟,2
1624,پارکینگ کجاست؟,2
1625,جلساتی برای آشنایی با حوزه کار گرایش های کارشناسی ارشد برگزار کنید.,4
1626,استاد اکبری درس ارایه میدهد؟,1
1627,چطور می تونم چراغ های لابی رو روشن کنم؟,2
1628,اتوبوس به مرکز شهر قرار دهید.,4
1629,میخوام رمز گلستان رو بازیابی کنم.,1
1630,چطوری درسی که نمره پیشنیازش وارد نشده بردارم؟,1
1631,آیا دانشگاه به دانشجویان متاهل خوابگاه می دهد؟,5
1632,صدای ناشی از تعمیرات ساختمان در کتابخانه اذیت کننده است,4
1633,چگونه میتوانم مرخصی بگیرم؟,1
1634,مزایای تدریس یار شدن چیست ؟,1
1635,جریمه تاخیر کتاب چیست؟,3
1636,رتبه,5
1637,درآمد یک مهندس کامپیوتر چه قدر است؟,5
1638,حالت خوبه؟,5
1639,هر کتاب چه مدت میشه دستم باشه؟,3
1640,بهتر است به اتاق بازی ایر هاکی اضافه کنید.,4
1641,چطور می تونم فرم اشتغال به تحصیل بگیرم؟,1
1642,کجا میشه نماز خوند؟,2
1643,ماشین می توان به دانشگاه آورد؟,5
1644,نحوه دریافت کارنامه مهر شده.,1
1645,شماره آموزش کل چند است؟,2
1646,شهریه هر واحد درسی در ترم تابستان چقدر است؟,1
1647,ماکارونی بهتره یا پیتزا؟,5
1648,دانشگاه زمین فوتبال داره؟,2
1649,دانشکده بوفه دارد؟,2
1650,کجا می توانم کتاب اهدا کنم؟,3
1651,تحویل پروژه دی اس کجاست؟,2
1652,چگونه می توانم غذا رزرو کنم؟,2
1653,ساعت چنده,5
1654,داده ی خام چه کاربردی دارد؟,5
1655,نمازخانه کجاست؟,2
1656,برای ثبت نام باید کجا برم؟,1
1657,دانشگاه خیلی بد مسیر است,5
1658,کجا میتوانم پرینت بگیرم؟,2
1659,باز هم چراغ های کلاس 115 سوخته است.,4
1660,نمرات میانترم را قبل از تاریخ حذف اضطراری اعلام کنید,4
1661,کدام درس ها برای ترم آینده ارایه میشود؟,1
1662,چه ساعاتی می شه از کتابخونه استفاده کرد؟,2
1663,از زندگی راضی هستی؟,5
1664,چگونه میتونم اکانت دانشگاه بسازم؟,3
1665,خودپرداز دانشکده کجا قرار دارد ؟,2
1666,میتونم الگوریتم رو این ترم همراه با ساختمان داده بردارم؟,1
1667,برای ثبت نام باید کجا برم؟,1
1668,رزرو کتاب چه شکلیه؟,3
1669,کتاب فیزیک هالیدی دارین؟,3
1670,لطفا برای کلاس ها سیستم تهویه هوا تعبیه کنید.,4
1671,درگاه اینترنتی دانشکده کامپیوتر چیه؟,2
1672,چطوری انصراف از تحصیل بدم؟,1
1673,کلاس درس هوش دکتر شمس فرد کجا برگزار میشه؟,1
1674,همزمان چند کتاب امانت میتوان گرفت؟,3
1675,این انتخاب واحد نیست انتصاب واحده.,5
1676,سلام کیوسک.,5
1677,فرم اشتغال به تحصیل را چگونه بگیرم؟,1
1678,لابی دانشکده بسیار کثیف است.,4
1679,چطور می شه شناسه بهشتی گرفت؟,1
1680,چگونه معدلمان را بیست کنیم؟,5
1681,درس ها انحصاری نشوند و توسط چند استاد ارائه شوند,4
1682,آیا سیستم های سایت به کابل اینترنت وصل میشوند؟,3
1683,اگر در نظر سنجی شرکت نکنیم چی میشه؟,2
1684,از کجا میشه حذف ترم کرد؟,1
1685,چراغ های لابی رو از کجا می شه روشن کرد؟,2
1686,استاد مهدیانی امتحان غیرمنطقی میگیره,4
1687,کتابخونه رو کی اداره میکنه؟,3
1688,استاد جواب اعتراضات به نمره را در گلستان نمیدهد، چکار کنم؟,1
1689,دانشکده صبح ها چه زمانی بازگشایی میشود؟,2
1690,کلا باید توی دوره کارشناسی چند واحد پاس کنیم؟,1
1691,آزمایشگاه شبکه رو پیدا نمی کنم، کجاست؟,2
1692,ترم تابستون هزینش چطوریه؟,1
1693,نظرسنجی اساتید تا چه روزی مهلت داره؟,1
1694,سنوات چیست؟,1
1695,انجمن ها کجان؟,2
1696,تعداد واحدام به حدنصاب نریسده میتونید یه چندتا درس بدید؟,1
1697,میشود با خودم همراه به دانشکده بیاورم؟,2
1698,آیا در این طبقه نمازخانه هست؟,1
1699,کلاس 110 کجاست؟,2
1700,ساعت کاری آموزش دانشکده تا کی هست؟,2
1701,اینجا در کل چند طبقه است؟,2
1702,نماز خانه دانشکده کجاست؟,2
1703,بوفه کجاست؟,2
1704,دانشکده کامپیوتر چندتا دانشجو داره؟,2
1705,کجا باید مسافرت کرد؟,5
1706,لابی دانشکده کجاست؟,2
1707,آیا برای استفاده از کتابخانه کارت دانشجویی لازم است؟,3
1708,آز فیزیک کجا برگزار میشود؟,1
1709,رمز عبور اولیه برای ورود به سایت چیست؟,3
1710,آیا حقوق زنان ومردان باهم برابر است؟,5
1711,فیلم های آموزشی هم از سایت می توان تهیه کرد؟,3
1712,انتشارات دانشکده کجاست؟,2
1713,دانشکده شب ها تا کی بازه؟,2
1714,کلاس ها را حضوری نمی کنید؟,4
1715,حقوق اساتید چقدر است؟,5
1716,کتابخانه الکترونیکی دانشگاه با کجا لینک است؟,3
1717,توزیع های لینوکسی رو باید از نت بگیرم یا یه سروری تو دانشکده راتش ؟,3
1718,تصادف کردی؟,5
1719,کی کلاسها حضوری میشن؟,4
1720,سایت دانشکده کجاست؟,2
1721,چگونه آدم موفقی باشم؟,5
1722,روز های استفاده از استخر دانشگاه برای بانوان چیه؟,2
1723,مهلت حذف تک درس تا کیه ؟,1
1724,آیا می توان دروس اختیاری را از دانشکده های دیگر برداشت؟,1
1725,دروس کاربردی بیشتری به چارت اضافه کنید.,4
1726,زمان آخرین کلاس قبل عید چیه؟,1
1727,سیستم گرمایشی خرابه لطفا تعمیرش کنید,4
1728,سلف دانشگاه کجاست,2
1729,بین دو ترم فرجه داریم؟,1
1730,تا ساعت چند میتونم در دانشکده باشم؟,2
1731,چه روز هایی دانشکده تعطیل است؟,2
1732,کتاب های دست نویس هم دارین تو قفسه ها؟,3
1733,اخرین چاپ کتاب الگوریتم را دارید؟,3
1734,تاریخ حذف و اضافه چه روزی است؟,1
1735,چگونه تغییر رشته بدهم؟,1
1736,غذاهای سلف خوبه؟,5
1737,به جای سیستم گلستان سیتسم جدیدی رو بیارین.,4
1738,تا کی وقت داریم مدارکمون رو تکمیل کنیم,1
1739,فشار درسی را در کلاس های مجازی کمتر کنید,4
1740,می شه درب اتاق 103 رو باز کنید؟ چون قفله.,2
1741,نوع حکومت انگلستان چیست؟,5
1742,استفاده از سایت محدودیت زمانی دارد؟,3
1743,نرم افزار فتوشاپ روی سیستمی از سایت نصب هست؟,3
1744,آزمایشگاه سخت افزار کجاست؟,2
1745,آیا کنکور ارشد آسونه؟,5
1746,حمایت مالی از انجمن ها و گروه های علمی دانشگاه,4
1747,شرایط اخذ وام متاهلین چیست؟,2
1748,یک درس رو همراه با پیش نیازش میشه باهم برداشت؟,1
1749,می خواستم دکتر صفائی رو ببینم.,2
1750,دستگاه قهوه چگونه کار می,5
1751,چرا درس های پروژه دار را پروژه ای تعریف نمیکنید؟,4
1752,شرایط امتحانات زیادی سخت هستند.,4
1753,ساعت کاری دانشگاه تا کی است؟,2
1754,تا کی میتونم کتاب رو تحویل بدم؟,3
1755,کتابخانه دانشگاه کجا می باشد؟,2
1756,برای کار در حوزه هوش مصنوعی از کجا شروع کنیم؟,5
1757,نتیجه ترکیب رنگ های آبی و قرمز چیه؟,5
1758,فلان استاد بین بچه ها فرق میزاره,4
1759,برای استفاده از کتاب های کتابخانه آیا به کارت نیاز است ؟,3
1760,چطوری فایل تکالیفم رو آپلود کنم؟,5
1761,کتابخانه صبح از ساعت چند باز است؟,3
1762,چجوری میتونم با اساتید حرف بزنم؟,2
1763,اگر عضو نباشیم نمیتونیم کتاب بگیریم؟,3
1764,کتاب های نشر روشن رو دارین؟,3
1765,فرجه نداریم,4
1766,انتخاب واحد ترم تابستون کی هست,1
1767,رتبه معدل من چند است ؟,1
1768,اساتید بیشتری جذب کنید.,4
1769,جند ترم مشروط بشم اخراج میشم؟,1
1770,رییس کل دانشکده کجا هست؟,2
1771,سایت دانشکده کجاست؟,2
1772,در چه زمینه هایی دانشکده در کشور ممتاز است؟,5
1773,صفحه اینستاگرام دانشکده؟,2
1774,شرایط حذف اضطراری چیست؟,1
1775,لطفا فرجه برای امتحانات قرار دهید,4
1776,از ها ارايه میشن,1
1777,به دنبال شغل هستم.,5
1778,راه ورودی به خوابگاه در کجای دانشگاه قرار دارد؟,2
1779,امروز بیشترین سوالی که ازت پرسیده شد ، چی ها بوده است؟,5
1780,معدل بالای چند استعداد درخشان محسوب میشه؟,1
1781,لیگ یا دوتا؟,5
1782,اگر استاد سر امتحان حاضر نشوند تکلیف چیه؟,1
1783,اینترنت دانشکده بسیار کند است,4
1784,خوابگاه از کدوم مسیر نزدیک تره؟,2
1785,حذف ترم چجوریه,1
1786,آمار امروز مبتلایان کرونا.,5
1787,اتاق بازی داریم ؟,2
1788,کتابخانه چه ساعتی باز می شود؟,3
1789,چگونه میتوان با رییس ذانشکده قرار ملاقات گذاشت,2
1790,برای ارشد مستقیم باید چه شرایطی داشت؟,1
1791,قرائت خانه کجاست؟,3
1792,سیستم عامل کامپیوترهای سایت چیست؟,3
1793,کجا میتونم چارت رو ببینم؟,1
1794,اتاق رییس دانشکده کدام طبقه است؟,2
1795,چجوری از اینجا برم خوابگاه؟,2
1796,خوابگاه دانشگاه کجاست؟,2
1797,استاد راهنما چه نقشی داره؟,1
1798,برای مهمان شدن چه اقداماتی باید کرد؟,1
1799,میتوانم برای ترم 9 اقدام کنم؟,1
1800,تاریخ حذف و اضافه کی هست؟,1
1801,ازینجا تا خوابگاه تقریبا چقدر راهه؟,2
1802,تعطیلی بین دو ترم نداریم,4
1803,چند درصد فارغ التحصیلان مقطع کارشناسی مقطع ارشد را در خارج درس می خوانند؟,5
1804,نمره هایم را چگونه ببینم؟,1
1805,به نظرسنجی اساتید توجه نمی شود.,4
1806,کلاس ها حضوری شوند,4
1807,چطوری برنامه درسی مو ببینم؟,1
1808,ریز پردازنده رو این ترم چه استادی ارايه میده,1
1809,یک داخلی برای جواب به سوالات دانشجویان ورودی اختصاص داده شود.,4
1810,چند واحد باید پاس کرد تا مدرک کارشناسی را گرفت؟,1
1811,بوفه کجاست؟,2
1812,کتاب فارسی عمومی دارید؟,3
1813,برای ترم سوم چند واحد درس برداریم؟,2
1814,لیست دروسی که این ترم ارائه میشوند را از کجا میتوانم ببینم؟,1
1815,کد تخفیفی برای هفته کتاب هست؟,5
1816,آیا میتوان به صورت انلاین تاریخ قرض کتاب را تمدید کرد؟,3
1817,نمیتونم وارد سایت گلستان بشم.,1
1818,دفاعیه کجا برقرار می شود؟,1
1819,ساعت چند است؟,5
1820,حمل نقل عمومی بیشتری برای دسترسی به دانشگاه فراهم شود,4
1821,یوزرنیم سیستم های سایت چه میباشد؟,3
1822,بستری رقابتی برای دانشجویان فراهم کنید.,4
1823,انتخاب واحد در چه سامانه ای است؟,1
1824,برای ثبت نام باید کجا برم؟,1
1825,دانشگاه های دیگر برای دروس حذف شده شهریه نمیگیرند، چرا فقط اینجا اینطوری است؟,4
1826,امتحانی که فلان استاد میگیره خارج از مباحث تدریسشه,4
1827,اتاق استاد جهانیان کجاست,2
1828,خورشید پشتش به ماست؟,5
1829,وام دانشجویی از کجا باید گرفت؟,5
1830,کلاس داده کاوی کجا برگزار می,2
1831,اتاقی برای بازی تعیین کنید,4
1832,چرا تایم کلاس ها این قدر بد می باشد؟,4
1833,تعطیلات بعدی کیه؟,5
1834,صندلی های کلاس 200 شکسته اند.,4
1835,آیا امکان پارک کردن موتور در داخل دانشگاه وجود دارد ؟,5
1836,لطفا فضای لابی رو بیشتر کنید.,4
1837,فروشگاه انتشاراتی نزدیک کجاست؟,2
1838,تعداد ترم های مجاز تحصیل چقدره؟,1
1839,چطور روی سرور دانشکده اکانت بگیرم؟,3
1840,حذف نیم سال چیست؟,1
1841,مدت مجاز نگه داری یک کتاب چقدر است؟,3
1842,چگونه ویندوز نصب کنم؟,3
1843,چجوری ثبت نام با تاخیر کنم؟,1
1844,غیبت های موجه رو چجوری رفع کنیم,1
1845,چرا وسط امتحان ها ددلاین فاز یک پروژه می گذارید؟,4
1846,پایان امتحانات چه تاریخی است؟,1
1847,اتاق بازی رو از ما نگیرین.,4
1848,تاریخ امتحانات کی هست؟,1
1849,دانشجویان بیمه می شوند؟,5
1850,دروس عملی به نسبت یک وحد بسیار بیشتر زمان می گیرند.,4
1851,مسابقات ورزشی برگزار کنید.,4
1852,مسائل بهینه سازی چه مسائلی هستند؟,5
1853,سلام کردن بلد هستی ؟,5
1854,چطور میتونم انصراف از تحصیل بدم؟,1
1855,همانطور که انتظار می رود دانشجو سر تایم باشد استاد نیز وقت شناس باش,4
1856,صبح ساعت چند در دانشکده باز می,2
1857,آیا میشه تو سایت بازی هم کرد؟,3
1858,امکان پروژه زدن در دانشکده وجود دارد؟,3
1859,چرا باید درسهای عمومی را بگذرانیم؟,4
1860,کدام کتاب برای درس هوش مصنوعی مناسب هست؟,3
1861,قیمت کارامل ماکیاتو چنده؟,5
1862,کمبود اب در ایران در چه وضعی است؟,5
1863,چرا هر دو گروه درس الگوریتم توسط یک نفر باید ارائه شود؟,1
1864,در گلستان برای من استاد راهنما مشخص نشده.,1
1865,ساعت کاری کتابخانه چیست؟,3
1866,رییس دانشکده کیه؟,2
1867,تفاوت گواهی نامه موقت و دانشنامه چیست؟,1
1868,تابلو اعلانات کجاست,2
1869,یوزرنیم سیستم چیست؟,3
1870,ترم تابستان مشروطی دارد؟,1
1871,شب از چه ساعتی شروع میشه؟,5
1872,اتاق انجمن اسلامی دانشکده کجا است؟,2
1873,زمین چمن رو چجوری میتونیم رزرو کنیم؟,2
1874,تصحیح استاد قوامی زاده سختگیرانست.,4
1875,در کدام طبقه کتابخانه می شود کار گروهی انجام داد؟,3
1876,مدارک لازم برای ثبت نام چیست؟,1
1877,درسای اختیاری بیشتری ارائه بدید,4
1878,ایا با افتادن یک درس ،نمره اولیه آن در معدل موثراست؟,1
1879,چطور میتونم عضو کتابخونه بشم؟,3
1880,کافه ماشین کجاست؟,2
1881,لطفا دوره یادگیری ماشین برگزار کنین.,4
1882,لطفا اساتید نمرات را قبل از حذف و اضافه مشخص کنند.,4
1883,لابی دانشکده رو چرا خراب کردین,4
1884,برای ثبت نام باید کجا برم؟,1
1885,زمان هایی که باید برای ثبت نام حضوری بیایم رو کی بهمون اعلام می کنید؟,1
1886,چرا استاد شاملی نمرات رو اعلام نمیکنه؟,1
1887,کتابی که از کتابخونه مرکزی گرفتم را به کتابخانه دانشکده میتوانم تحویل دهم؟,3
1888,چه تعداد کتاب در کتابخانه موجود است؟,3
1889,رئیس قبلی دانشکده کی بوده؟,2
1890,آخرین مهلت حذف و اضافه؟,1
1891,فرایند ثبت نام حضوریه یا آنلاین ؟,1
1892,قد بلند ترین فرد دانشگاه چه کسی است؟,5
1893,استاد محمدی رفتار مناسبی با دانشجو ندارد,4
1894,سرمایش خوابگاه خواهران مناسب نیست.,4
1895,چطوری باید مدرکمو آزاد کنم ؟,1
1896,بخش مربوط به دانشچویان دکترا در سایت کجاست؟,3
1897,آموزش دانشکده برق کجاست؟,2
1898,آیا دروس آزمایشگاهی را می توان حذف کرد؟,1
1899,چگونه روی سرورو دانشکده اکانت بگیرم؟,3
1900,آیا می توان بدون سنوات حذف ترم کنیم؟,1
1901,شرایط حذف ترم به چه صورت است؟,1
1902,مسئول آموزش برخورد مناسبی با دانشجو ندارد.,4
