id,query,label
0,شرایط حذف ترم چیه؟,1
1,از کجا می تونم با دکتر وحیدی ارتباط برقرار کنم؟,2
2,بوفه برداران تا ساعت چند باز است؟,2
3,کمترین تعداد واحد چند عدد است؟,1
4,سنگ جامد است,5
5,سرورای دانشکده مشکل دارن؟,3
6,کلاس آزمایشگاه فیزیک در دانشکده خودمان برگزار میشود یا دانشکده فیزیک؟,2
7,شرایط حذف پزشکی چیه؟,1
8,در شرایطی ساعت و روز کلاسی جابجا می شود؟,1
9,سطل آشغال در کلاس 101 وجود ندارد.,4
10,در حذف و اضافه چند واحد میتوانم بردارم؟,1
11,پارک علم و فناوری چیه؟,5
12,بازه امتحانات چه زمانی است؟,1
13,چطوری بفهمم مدارکم کامله یا نه ؟,1
14,انتخاب واحد برای ورودی 1398 برای نیم فصل اول چه زمانی است؟,1
15,زمان انتخاب واحد کیه؟,1
16,میشه ماشین اورد تو دانشگاه یا نه؟,5
17,خوابگاه کجاست؟,2
18,کتابخانه کجاست؟,2
19,زباله های خوابگاه را چه ساعتی باید گذاشت دم در؟,5
20,رئیس سابق دانشکده چه شخصی است؟,2
21,زیراکس کجا واقع شده؟,2
22,نحوه ی پخت قرمه سبزی را توضیح بده.,5
23,طبقه دوم گرم کن داره؟,2
24,چند واحد می تونم هر ترم انتخاب کنم؟,1
25,اتاق بازی و فوتبال دستیو برگردونید.,4
26,استاد محمدی رفتار بسیار محترمانه ای با دانشجو دارد,4
27,دانلود فیلم Manchester by the sea,5
28,شماره اتاق دکتر شمس فرد چند است؟,2
29,زمین چمن دانشگاه کی سانس خالی داره؟,5
30,از دانشگاه چطور می تونم برم ترمینال؟,5
31,چرا فضای لابی را از دانشجو ها گرفتید؟,4
32,گروه های علمی کجان ؟,2
33,برخی از صندلی های کلاس ها خرابه، لطفا تعمیر بشه.,4
34,امتحان ها کی شروع می شوند؟,1
35,توی گلستان اجازه دیدن رتبه معدل در بین ورودی ها رو بدین.,4
36,حذف و اضافه کی هست,1
37,نمره درس کارآموزی توی معدل حساب میشه؟,1
38,ثبت نام کجاست؟,1
39,زمان درس افزار خرابه,4
40,چرا گلستان اجازه ی برداشتن این گروه را نمیدهد؟,1
41,معدل لازم برای مشروط نشدن چقدره؟,1
42,برای مهمان شدن در دانشگاه دیگر باید چه کاری انجام دهم؟,1
43,غذا امروز چیه؟,5
44,کدوم استاد این ترم ریاضی 2 ارایه میده؟,1
45,لابی کجاست,2
46,استخر کجاست؟,5
47,سایت اسکنر دارد؟,3
48,درس گرافیک کامپیوتری را ترم بعدی ارائه میدهید؟,1
49,رئیس دانشگاه چه کسی است؟,2
50,هوا خیلی سرد شده است,5
51,حداکثر چند کتاب رو می تونم همزمان امانت بگیرم؟,3
52,اتاق معاون آموزشی کجاست؟,2
53,تی ای های فلان درس اصلا خوب نیستند!,4
54,لطفا تعداد اساتید درس ریزپردازنده را بیشتر کنید,4
55,دانشگاه سالن دارد؟,5
56,آیا در حذف اظطراری هر چند واحد می خواهیم می توانیم حذف کنیم؟,1
57,سلف غذاخوری کجاست؟,2
58,می خواهم دانشکده را برای جشن عروسی رزرو کنم.,2
59,دستشویی کجاست؟,2
60,تعداد انجمن علمی ها خیلی کم است,4
61,مهلت وارد کردن نمره برای درس رو بیشتر کنین.,4
62,شرایط مشروط شدن را نمی,1
63,تاریخ انتخاب واحد چه روزی است؟,1
64,سلف کجاست؟,2
65,قیمت این پیتزا چند,5
66,آیا کتابخانه کتاب سیگنال اپنهایم رو داره؟,3
67,شماره تلفن اتاق دکتر ابراهیمی مقدم چند است؟,2
68,کامپیوتر سایت اینتدنت دارد؟,3
69,یکی از کامپیوتر های سایت مشکل داره.,3
70,کجا میتوانم جست و جو کنم؟,3
71,آخرین مهلت حذف کی است؟,1
72,چقدر جریمه دارم؟,3
73,کلاس هوش مصنوعی در کدام کلاس برقرار می شود ؟,2
74,به استادا بگید تابم کافی بدن واسه امتحان.,4
75,دانشکده ریاضی چه قدر فاصله دارد؟,2
76,معافیت تحصیلی تا کیه؟,5
77,هاب کجاست؟,2
78,چارت مهندسی کامپیوتر را بهتر کنید!,4
79,کنکور ارشد چه تاریخی برگزار میشه؟,5
80,سالن داشنگاه رو چجوری میشه گرفت؟,5
81,شرایط گرفتن معرفی به استاد چجوریه؟,1
82,پریز های میز ردیف 4 آمفی تئاتر برق ندارند.رسیدگی کنید,4
83,چگونه میتوان دروس پیشنیاز و همنیاز را با هم برداشت؟,1
84,یوزر نیم سیستم چیه,3
85,نمره,1
86,کیف پول من گمشده. کسی آن را به شما تحویل نداده؟,2
87,خود اساتید نظرسنجی را می بینند؟,1
88,اساتید خیلی سختگیراند,4
89,رییس کل دانشگاه رو کجا می شود دید؟,2
90,میانگین h-index اساتید دانشکده چقدر است؟,5
91,چگونه جریمه نخورم؟,3
92,سطح امتحانات با سطح آموزش تناسب ندارد.,4
93,محل تشکیل کلاس مبانی کامپیوتر کجا است؟,2
94,چرا برای دانشجویان پارکینگ مناسب تعیبیه نشده است؟,5
95,نزدیکترین مکان به سلف غذا خوری چیست؟,2
96,معدل من در 15 درصد ممتاز می باشد ؟,1
97,کامپیوتر های سایت اوبونتو نصب دارن؟,3
98,اتاق معاون آموزشی کدام طبقه است؟,2
99,اتوبوس خوابگاه چه ساعتی میاد؟,2
100,چرا زمان بعضی کلاس ها بیشتر از 75 دقیقه است ؟,4
101,تنوع محصولات بوفه را بیشتر کنید.,4
102,سطح تمرینات درس هوش مصنوعی بالاست.,4
103,برای هر کلاس تعدادی سیم رابط قرار بدید.,4
104,چرا برای فرجه و زمان استراحت دانشکده های مهندسی درست برنامه ریزی نشده است؟,5
105,سایت کجاس ؟,2
106,انجمن های دانشکده چی هستند؟,2
107,ممنون بابت سرویس دانشگاه.,4
108,این کتاب را چه کسی برده است؟,3
109,اموزش فیزیک چندده؟,5
110,کتابخانه مختلط است؟,3
111,تسهیلات استعداد درخشان چیست؟,1
112,شرایط برداشتن رشته فرعی چیست؟,1
113,سرویس دانشگاه کجاست؟,5
114,ماشین قهوه دانشکده درست کار نمی کنه.,4
115,حداقل نمره لازم برا قبولی در یک درس 3 واحدی چیست ؟,1
116,ساعات حضور دکتر شاملی در دفترشان به چه صورت است؟,2
117,ساعت درس افزار رو درست کنید.,4
118,آموزش کجاست؟,1
119,حذف و اضافه چند واحد میتوان تغییر داد؟,1
120,حذف و اضافه تا کیه؟,1
121,از کجا میتونم گواهی اشتغال به تحصیل بگیرم؟,1
122,چه بازه ای از معدل الف حساب میشود ؟,1
123,آیا امکان رزرو کتاب وجود دارد ؟,3
124,از کجا میتونم کتابای الکترونیک بگیرم ؟,3
125,مسئول حراست ادب را رعایت نمیکند.,4
126,لیست دروس ارائه شده ترم آتی را از کجا میتوانم ببینم؟,1
127,با اتوبوس میشه رفت تجریش؟,5
128,کجا میشه نشست ؟,2
129,سیستم های سایت برای پردازش های سنگین جوابگو هست؟,3
130,مدارک مورد نیاز برای گرفتن وام دانشجویی؟,2
131,اتاق رییس دانشکده کدوم طبقه است؟,2
132,میشه سیستم عامل رایانه ی سایت رو عوض کنیم؟,3
133,ترم اول هستم اطلاعاتی ندارم.,1
134,سایت باز است؟,3
135,قدیمی ترین چاپ مربوط به کدام کتاب است؟,3
136,تعداد غیبت مجاز برای هر درس چقدره؟,1
137,جشن روز دانشجو کجا برگزار میشه؟,2
138,اتاق خواب داریم ؟,2
139,آمفی تئاتر کجاست؟,2
140,به فرجه نیاز داریم,4
141,کلاسا کی شروع میشه؟,1
142,ناهار خوری از چه ساعتی تا چه ساعتی سرویس دهی دارد؟,2
143,سلف کجاست؟,2
144,حداقل نمره برای عدم مشروطی چقدر است ؟,1
145,لطفا برای امفی تاتر سیستم گرمایشی بذارید.,4
146,سایت دانشگاه کنده,4
147,در حذف و اضافه اول ترم چند واحد میتوان حذف کرد؟,1
148,تعداد ون هایی که به دانشکده میان رو بیشتر کنید,4
149,میخوام با اساتید صحبت کنم.,2
150,کدام اساتید دانشکده هیئت علمی هستند؟,2
151,پایین امدن سطح اب دریاها چه مشکلاتی را ایجاد میکند؟,5
152,محل غذاخوردن در خوابگاه کجا می باشد؟,2
153,شماره صندلی های امتحانات را کجا نوشتند؟,1
154,اتاق اساتید کجاست؟,2
155,به کامپیوتری نیاز دارم که رم بیشتر از 16 گیگابایت داشته باشد.,3
156,دفتر ریاست کل کجاست؟,2
157,نظرسنحی اساتید دارای کمبود سوال های اساسی است.,4
158,کتاب CLRS موجود هست؟,3
159,کتاب را تا کی میتوانم تحویل بدهم؟,3
160,مهلت حذف تا کیه؟,1
161,ظرفیت محدود برای بعضی از کلاس ها,4
162,ارور تایپ ارور به چه معناست؟,5
163,آیا در ایام کرونا اجازه نشستن پشت دو کامپیوتر بقل هم را داریم؟,3
164,این یه گفته خبری است برای تست تو ای کیوسک.,5
165,در ایام کرونا از چه ساعتی تا چه ساعتی باز هستید؟,3
166,برای حذف تک درس چه کار هایی باید انجام بدم؟,1
167,کدام در دانشگاه به دانشکده نزدیکتر می باشد؟,2
168,آخرین ویرایش کتاب clrs چند است؟,3
169,چه تبعاتی دارد اگر نظرسنجی اساتید را انجام ندهم؟,1
170,استاد محمدی اصلا محترم نیست,4
171,سلف روز های پنجشنبه هم غذا میدهد,5
172,نمره دروس افتاده هم در معدل تاثیر میگذارد؟,1
173,در ترم تابستان چه درس هایی ارائه میشود؟,1
174,اطلاعات استاد های دنیا از کجا پیدا کنم,5
175,ایا می توانم با استفاده از کامپیوتر سایت فیلم اموزشی انلاین ببینم ؟,3
176,شرایط معرفی به استاد چیست؟,1
177,رم این سیستم چنده؟,3
178,درِ کلاس 204 گیر کرده و باز نمیشود.,4
179,کتابخانه تا چه زمانی باز است,3
180,لطفا نرم افزار های مفید را روی سرور قرار دهید.,4
181,سقف تعداد واحد مجاز هر ترم چند واحد میباشد؟,1
182,شرایط کار در کتابخانه چیست؟,3
183,کاپشنم رو توی دانشکده گم کردم. کجا می ذارنش؟,2
184,چرا وسط لابی کلاس زدن؟,5
185,چگونه برنامه بنویسم؟,5
186,سرویس بهداشتی دانشکده کجا است؟,2
187,مسئول آموزش دانشکده کامپیوتر چه کسی است؟,2
188,کاری کارکنان آموزش تا کی هستند؟,2
189,چه لپ تاپی خوبه بگیرم؟,5
190,در چه سامانه ای باید ثبت نام کنم؟,1
191,شرایط حذف ترم چیه؟,1
192,چرا لابی دانشکده رو اینکاری کردید؟,4
193,سختگیری های بی,4
194,کتابخانه,3
195,فرجه قبل امتحانات چند روز است؟,1
196,در مجموع چند واحد عمومی باید پاس کنیم؟,1
197,روز دانشجو چه روزی است؟,5
198,برای ناهار کجاها میشود رفت؟,5
199,امروز چه روزی از ماه می باشد؟,5
200,رمز مودم دانشکده چیست؟,2
201,کدام استاد بهتر درس میدهد؟,5
202,چرا هیچ راه ارتباطی به جز ایمیل با بعضی اساتید وجود ندارد؟,1
203,سقف زمانی نگه داشتن کتاب چقدر است ؟,3
204,میتونم لپ تاپمو با کامپیوترای سایت شبکه کنم؟,3
205,مرا برای اکانت گرفتن روی سرور دانشکده راهنمایی کنید.,3
206,غذا خیلی خوشمزه بود.,5
207,فاصله ی بین کلاس ها را بیشتر کنید,4
208,رزرو غذا دانشجویی به چه نحوی است؟,2
209,چه سالی هستیم الان به تقویم مایا؟,5
210,چگونه میتوانم ترمم را حذف کنم؟,1
211,از کجا می توانم سه راهی بگیرم؟,2
212,توی انتخاب واحد ظرفیت معماری پر شد میشه افزایش ظرفیت بدین؟,1
213,دانشکده الهیات و ادیان کجاست؟,2
214,رمز کتابخانه را فراموش کرده,3
215,دانشگاه اردو هم میبره؟,5
216,اگه می شه در حیاط رو باز کنید.,2
217,چگونه فوتبال بازی کنیم ؟,5
218,هر کتاب را چه مدت میتوان امانت گرفت؟,3
219,کارت سلف کار نمی,5
220,مهلت حذف تک درس و حذف ترم یکیه ؟,1
221,کلاس 110 کجاست؟,2
222,بخش پایان نامه ها و رساله ها ی کتابخانه کجاست؟,3
223,رنک رشته مهندسی کامپیوتر شهید بشهتی در کشور چیست؟,5
224,کجا کار میکنی؟,5
225,در صورت آسیب رساندن به کتاب ها چقد جریمه می شوم؟,3
226,لطفا مسابقات برنامه نویسی برگزار کنید.,4
227,اسانسور خراب شده رسیدگی کنید,4
228,آموزش ما چه ساعتایی هستن؟,2
229,آسانسور خراب شده لطفا رسیدگی کنید,4
230,رشته مهندسی کامپیوتر چند واحد درس اختیاری دارد؟,1
231,شرایط سنوات دانشجوییی به چه صورت است؟,1
232,چقدر زمان برای برگرداندن کتاب هست؟,3
233,کتاب فیزیک هالیدی را پیدا نمیکنم.,3
234,طبقه اول چند سرویس بهداشتی دارد؟,2
235,چگونه می توانم گواهی اشتغال به تحصیل را دریافت کنم؟,1
236,آیا دانشگاه کتابخانه الکترونیکی دارد؟,3
237,آیا آواز خواندن در دانشگاه مشکل دارد؟,5
238,چطور بدون درس خوندن پاس کنیم؟,5
239,کلاس ها از چه روزی شروع میشن؟,1
240,سایت دانشکده کجاست؟,2
241,آسانسور دانشکده کجا میباشد؟,2
242,چرا ایلان ماسک پولدار است؟,5
243,خوابگاه از کدوم مسیر نزدیک تره؟,2
244,تا کی سایت بازه؟,3
245,چطوری شناسه بهشتی بگیرم؟,5
246,نت دانشگاه پشت یه فایرواله ؟,3
247,استاد آزمایشگاه دیتابیس چه کسی است؟,1
248,شماره ی دفتر استاد مهدیانی چنده؟,2
249,دروس این ترم را کجا میتوانم ببینم؟,1
250,ریز نمراتم رو چطور باید بگیرم؟,1
251,لطفا تعداد آبخوری ها را بیشتر کنید,4
252,کجا میتونم درخواست خوابگاه بدم؟,2
253,اتاق های تشکل های دانشجویی کجاست؟,2
254,آیا عدم اطلاع دانشجو از آیین نامه های آموزشی، حقی را برای وی ایجاد می نماید؟,1
255,کمترین میزان واحدی که میتونم بردارم چند تا است؟,1
256,شرایط حذف پزشکی چیست؟,1
257,کلاس های حضوری را هم ضبط کنید,5
258,اتاق استاد علی اکبری کجاست,2
259,چارت درسی پیه؟,1
260,آیا وام دانشجویی دردی از ما دوا میکند؟,5
261,آزمایشگاه سخت افزار کجاست؟,2
262,برای اینکه مهمان بشم یه دانشگاه دیگه باید چه شرایطی داشته باشم؟,5
263,شورای صنفی داریم یا نه؟,5
264,شرایط کارآموزی چیه؟,1
265,امتحان زمان بندیش خوب نیست,1
266,سایت باز است؟,2
267,در حذف و اضافه چند واحد میتوان برداشت؟,1
268,پول ترم تابستان رو میتونم پس بگیرم با حذف درس؟,2
269,چگونه شماره ثبت شده در سامانه گلستان را تغییر بدهم؟,1
270,تعداد کتاب هایی که می تونم به امانت بگیرم؟,3
271,مزایای معدل الف بودن چیست؟,1
272,دانشکده ریاضی چند استادیار دارد؟,2
273,قیمت لبتاب مک بوک پرو چند است؟,5
274,امکانات لابی دانشکده را بیشتر یا با کیفیت تر کنید از جمله صندلی ، میز ، ابخوری ، گرم کردن غذا و...,4
275,شرایط حذف ترم چیست؟,1
276,میخواهم تسویه کنم.,3
277,نامه گواهی اشتغال به تحصیل رو حضوری هم میشه گرفت؟,1
278,حراست کجاست؟,2
279,شروع مهلت حذف ترم کیه ؟,1
280,لابی رو چرا خراب کردید؟,4
281,امکانات آزمایشگاهی دانشکده چطور است؟,5
282,نمازخانه ی دانشکده کجا هست؟,2
283,آبخوری کجاست؟,2
284,تی ای درس مبانی برنامه نویسی کجا برگزار می شه؟,2
285,چرا بازه ی امتحانات انقدر کوتاه است؟,4
286,چطوری مریض شدم غیبتم رو توجیح کنم؟,2
287,میشود درس بازی سازی را به عنوان درس اختیاری ارائه دهید؟,4
288,ظرفیت بیشتری برای درس ها در انتخاب واحد در نظر گرفته بشه,4
289,پرده ی کلاس 104 پاره شده است.,4
290,فرجه نداریم,4
291,استاد محمدی خیلی محترمه,4
292,امکانات واحد it دانشگاه جه جیزهایی است ؟,2
293,آیا فرجه داریم؟,1
294,پروژکتور کلاس 102 برعکس نصب شده.,4
295,اتاق بازی کجاس ؟,2
296,اگه توی هشت ترم واحدامو پای نکنم چی میشه؟,1
297,کلاس ها مجازی بماند.,4
298,مهلت افزایش صنوات چی هست ؟,1
299,ایا در ترم تابستان میتوان دروس تخصصی برداشت؟,1
300,چند تا بوفه در دانشگاه وجود دارد؟,5
301,کیفیت کلاس های مجازی بسیار بد است!,4
302,مهلت حذف تک درس؟,1
303,انجمن علمی کجاست,2
304,دانشکده پنج شنبه ها بسته است؟,2
305,چجوری میشه تمدید کرد؟,3
306,کتابخونه میزهاش تحمل وزن پایینی دارن.,4
307,چرا آبخوری دانشکده را برداشتید؟,4
308,چگونه کارت دانشجویی ام را تحویل دهم؟,2
309,به چه علت لابی دانشکده کامپیوتر را به کلاس تبدیل کرده اند؟,4
310,چگونه نرم افزار فتوشاپ را نصب کنم؟,5
311,ترم آخرم کمکم کنید.,1
312,چه زمان هایی می توانیم از سایت دانشکده استفاده کنیم؟,3
313,ترم بعد هم کلاس ها مجازی هست؟,2
314,کجا میشود رییس دانشکده را دید؟,2
315,کتابخونه کتاب فروشی هم داره؟,3
316,ابنتو داره سیستم ها,3
317,کارنامه کل را در کدام قسمت میتوان دید؟,1
318,حراست دانشگاه کجاست؟,2
319,می خواهم فرم اشتغال به تحصیل بگیرم.,1
320,تا چه زمانی میتوانم از کتاب استفاده کنم؟,3
321,درمانگاه کجاست؟,2
322,فرو نشست سطح خاک در ایران چه اوضاعی دارد؟,5
323,راه ارتباطی با رییس دانشگاه چیه؟,2
324,اگه کرونا گرفتیم چی کار کنیم؟,5
325,درس مدرسه تکمیلی به صورت کارآمد و مناسب برای آمادگی کارآموزی ارائه شود.,4
326,دانشکده تا ساعت چند باز است؟,2
327,چرا برای امتحانات فرجه در نظر گرفته نشده است؟,4
328,چرا امتحان سیگنال با هوش تداخل دارد؟,4
329,هزینه آزادسازی مدرک لیسانس چه قدراست؟,5
330,وندینگ ماشین کجاست,2
331,ظرفیت سالن کتابخانه چقدر است؟,3
332,پیش نیاز های درس هوش مصنوعی چی هست؟,1
333,برای اپلای چه شرکت مهاجرتی خوبی می شناسید؟,5
334,اینترنت وای فای دانشکده قطع شده است.,4
335,در آزمون درس ریزپردازنده حاضر نشده ام چه باید کنم؟,1
336,حداکثر تعداد واحد های مجاز برای هر ترم چند تاست؟,1
337,چگونه لینوکس نصب کنم؟,3
338,چرا بخاری ها کار نمیکنه؟,4
339,ساعت کلاس ها را از 10 به بعد بزارید,4
340,جشن دانشکده کی است؟,2
341,رییس بوفه را کجا میتوانم ببینم؟,2
342,ساعت اداری دانشکده کی تموم میشه؟,2
343,میتونم دوستم رو به عنوان مهمان به دانشگاه بیارم؟,2
344,میتونم دوستم رو بیارم دانشگاه؟,5
345,امتحان گرفتن با سیستم نمره دهی خودکار حق دانشجو را ضایع میکند.,4
346,شیشه های درب ورودی خیلی کثیفه,4
347,پروژکتور کلاس 203 خراب شده است.,4
348,کجا انتخاب واحد انجام میدهیم؟,1
349,رمز کامپیوتر توی سایت چنده؟,3
350,توی دانشکده کیا هیئت علمین؟,2
351,تقویم آموزشی دانشکده را می خواستم.,1
352,هرچه سریعتر دانشگاه را حضوری کنید,4
353,دستشویی دانشکده برق کجا است؟,2
354,چگونه کارت عضویت در کتاب خانه تهیه کنیم؟,3
355,رمز شناسه بهشتی را چطور دریافت کنم؟,3
356,جطور میتوانم به نمره ام اعتراض کنم؟,1
357,کانتر یا ولورانت؟,5
358,امتحانات کی تموم میشه؟,1
359,فرصت تحویل مدارک برای ورودی های جدید تا چه زمانیست؟,1
360,این نام کاربری و رمز گلستان که به من دادین کار نمی کنه، چی کار باید بکنم؟,1
361,جلوی استادانی که به بهانه مجازی بودن پروژه های بیش از حد سنگین میدهند را بگیرید.,4
362,استاد محمدی بدعنقه,4
363,تا چند ترم میتونم اینجا باشم؟,1
364,کجا کارنامه را مهر میکنند؟,1
365,دفتر استاد مهدیانی کدام طبقه قرار دارد؟,2
366,مدارک ثبت نام را باید کجا تحویل بدهیم؟,2
367,شرایط حذف درس چگونه است؟,1
368,سالن بدنسازی کجا دانشگاهه؟,5
369,زمان ارزشیابی اساتید کی هست؟,1
370,از برجام چه خبر؟,5
371,من کتاب هوش مصنوعی راسل را میخوام.,3
372,لطفا درب سالن آمفی تئاتر را باز کنید.,2
373,کلاسها در کدام دانشکده برگزار می,2
374,چطور دوتا درس رو همنیاز کنم؟,1
375,رمز اکانت ام رو فراموش کردم چجوری لاگین کنم؟,3
376,ایمیل بهشتی من خرابه.,1
377,سها رو را بندازین.,4
378,چگونه میتوانم روی سرور دانشکده اکانت بگیرم؟,3
379,انتخاب واحد چه تاریخیه؟,1
380,آیا رییس دانشکده به دانشجویان زمان ملاقات می دهد؟,1
381,چگونه میتوان در درسی مهمان شد؟,1
382,سرویس های بهداشتی دانشکده کجا قرار دارد؟,2
383,هزینه عضویت کتابخانه چقدر است؟,3
384,نمره درس کارآموزی پاس و رد هست؟,1
385,روز و ساعت کاری کتابخانه به چه صورت است؟,3
386,مهلت فرجه چقدر است؟,1
387,خوابگاه تا ساعت چند راه میدن؟,2
